{
  "block": "B-C002",
  "environment": {
    "lean": "leanprover/lean4:v4.33.1",
    "mathlib": "0df444a360eaa60ab8c11dca51a86af692955474"
  },
  "evidence_id": "E-000020",
  "findings": [
    "Re-issued after formal_statement was extended to include its definition closure (Section 6). The stage-1 read-back bundle already included the definitions, so the verdict is unchanged.",
    "Transcript: blocks/audits/B-C002-correspondence.md."
  ],
  "independence_caveat": "Two-stage blind protocol (Section 11.2): stage 1 (read-back) saw only the Lean declaration and its definitions; stage 2 (comparison) saw only the read-back and the contract. Both stages share this session's underlying model (deepseek-v4.1-flash), so common blind spots are not excluded.",
  "inputs": [
    {
      "artifact": "B-C002/formal_statement",
      "hash": "f37cc0f8977944a037f8c65c171f1c902396a89e70d315613493cfd85e7ad1d5"
    },
    {
      "artifact": "B-C002/informal_statement",
      "hash": "1c8874c1dfe45cd82384e4570e04dffb58486a66fd0f360eb330cd5f6ba4d955"
    },
    {
      "artifact": "B-D014/informal_statement",
      "hash": "1f69ac6b40f618f6620c281778fc48b3966349b78cb5090a39358cbd18e78f70"
    },
    {
      "artifact": "representation/encoding",
      "hash": "8a1880e1f10dc560193d4a98b870faed739b3ede4a08da9e8cf41de84787a657"
    }
  ],
  "layer": "correspondence",
  "outcome": "equivalent",
  "producer": {
    "kind": "agent",
    "model": "deepseek-v4.1-flash",
    "prompt_rev": "",
    "role": "comparator"
  },
  "timestamp": "2026-09-14T14:02:23Z"
}
