{
  "block": "B-L001",
  "environment": {
    "lean": "leanprover/lean4:v4.33.1",
    "mathlib": "0df444a360eaa60ab8c11dca51a86af692955474"
  },
  "evidence_id": "E-000115",
  "findings": [
    "Stage 1 read-back: two homomorphisms out of the free algebra agreeing on the inserted generators are equal; proved by induction over MemSg (generator case = hypothesis, operation case = hom equations + IH).",
    "Stage 2 comparator returned equivalent; T_Sigma(X), eta^X, IsAlgHom are the intended objects, no extra or missing hypothesis.",
    "Transcript: blocks/audits/B-L001-correspondence.md."
  ],
  "independence_caveat": "Two-stage blind protocol (Section 11.2): stage 1 (read-back) saw only the Lean declaration and definitions; stage 2 (comparison) saw only the read-back and the contract. Both stages share this session's underlying model (deepseek-v4.1-flash), so common blind spots are not excluded. Verdict is relative to the dependent-type carrier encoding; inherits its residuals.",
  "inputs": [
    {
      "artifact": "B-L001/definition_closure",
      "hash": "aac30166156f4d77d3e3ab3ae7c0a46e80efb4be8b50bc4f659a860a3f70f5eb"
    },
    {
      "artifact": "B-L001/formal_statement",
      "hash": "266a46cd1380c931c504fd032db9f221dade062c3433c701c66ec8f893dfc2f5"
    },
    {
      "artifact": "B-L001/informal_statement",
      "hash": "fc0f1078cd4de13656d6f2c6e18bdc94751019418528ee92e49eb9a9023145d4"
    },
    {
      "artifact": "representation/encoding",
      "hash": "96171838ac26a710e6ec51562eafa2979a0b52d3bc95c7bc12e989e6a621f2d1"
    }
  ],
  "layer": "correspondence",
  "outcome": "equivalent",
  "producer": {
    "kind": "agent",
    "model": "deepseek-v4.1-flash",
    "prompt_rev": "",
    "role": "comparator"
  },
  "timestamp": "2026-09-16T15:28:11Z"
}
