{
  "block": "B-P007",
  "environment": {
    "lean": "leanprover/lean4:v4.33.1",
    "mathlib": "0df444a360eaa60ab8c11dca51a86af692955474"
  },
  "evidence_id": "E-000058",
  "findings": [
    "Stage 1 read-back reconstructs ker_pr (Ker(pr^\u03a6) = \u03a6), the descent quotLift, and its existence (quotLift_comp) and uniqueness (quotLift_unique).",
    "Stage 2 comparator returned equivalent; all three clauses (Ker(f) \u2208 Eqv(A), Ker(pr^\u03a6) = \u03a6, universal property) match in direction and quantifiers.",
    "Transcript: blocks/audits/B-P007-correspondence.md."
  ],
  "independence_caveat": "Two-stage blind protocol (Section 11.2): stage 1 (read-back) saw only the Lean declarations and definitions; stage 2 (comparison) saw only the read-back and the contract. Both stages share this session's underlying model (deepseek-v4.1-flash), so common blind spots are not excluded. Verdict is relative to the dependent-type carrier encoding; inherits its residuals.",
  "inputs": [
    {
      "artifact": "B-D014/informal_statement",
      "hash": "1f69ac6b40f618f6620c281778fc48b3966349b78cb5090a39358cbd18e78f70"
    },
    {
      "artifact": "B-D015/informal_statement",
      "hash": "d261b714765b36cf3ac861c9ced3f2353a294d05b6e50d39c08f9494a24827d4"
    },
    {
      "artifact": "B-P007/formal_statement",
      "hash": "032edc48586c73e1595f88af6be937923fbb4567fd9ec4a06dd3b16b284ae949"
    },
    {
      "artifact": "B-P007/informal_statement",
      "hash": "94a73f9f3674e6d1d4f456c654a55e9a2d651aa0af22008a0ed028116e55032b"
    },
    {
      "artifact": "representation/encoding",
      "hash": "96171838ac26a710e6ec51562eafa2979a0b52d3bc95c7bc12e989e6a621f2d1"
    }
  ],
  "layer": "correspondence",
  "outcome": "equivalent",
  "producer": {
    "kind": "agent",
    "model": "deepseek-v4.1-flash",
    "prompt_rev": "",
    "role": "comparator"
  },
  "timestamp": "2026-09-15T16:15:38Z"
}
