{
  "block": "B-P026",
  "environment": {
    "lean": "leanprover/lean4:v4.33.1",
    "mathlib": "0df444a360eaa60ab8c11dca51a86af692955474"
  },
  "evidence_id": "E-000152",
  "findings": [
    "lake build under the dependent-type carrier model: B-P026 (Mslang.isCongruence_iInf, Mslang.congCogenerated_iInter_le) compiled against Mathlib v4.33.1.",
    "Proof: hchar shows the meet of the Omega^A(L^j) is contained in Ker(ch^{intersection L^j}) using B-P022(2) at each j; hcong shows the meet of congruences is a congruence (isCongruence_iInf); le_congCogenerated_of_isCongruence (B-P022(3)) then yields the refinement. Uses the new sortedEqv_iInf (arbitrary meet) from Prelim.lean.",
    "Axioms within {propext, Classical.choice, Quot.sound} (scripts/lean_audit.py, 202 declarations, 0 warnings, 0 unpermitted, 0 sorry)."
  ],
  "independence_caveat": "Verification is the local pinned build only; formal_proof is a source-level hash over the mapped declarations.",
  "inputs": [
    {
      "artifact": "B-P026/formal_proof",
      "hash": "a3fa70e2fcc8159e476168c393843c082c305d268a2a7ca01c3a8db4660f6c1f"
    }
  ],
  "layer": "verification",
  "outcome": "build_ok",
  "producer": {
    "kind": "build",
    "model": "deepseek-v4.1-flash",
    "prompt_rev": "",
    "role": "coordinator"
  },
  "timestamp": "2026-09-17T13:42:43Z"
}
