{
  "block": "B-D027",
  "environment": {
    "lean": "leanprover/lean4:v4.33.1",
    "mathlib": "0df444a360eaa60ab8c11dca51a86af692955474"
  },
  "evidence_id": "E-000111",
  "findings": [
    "lake build under the dependent-type carrier model: B-D027 (Mslang.genSet, TAlg, TSet, etaX) compiled against Mathlib v4.33.1.",
    "Encoding: T_Sigma(X) is the subalgebra Sg of W_Sigma(X) generated by the one-letter words (x); TAlg is subAlg over that generated subalgebra; etaX inserts x at (x). Reuses B-D021 (Sg) and B-D023 (subAlg)."
  ],
  "inputs": [
    {
      "artifact": "B-D027/formal_proof",
      "hash": "e52f4b6ef16e6b7a9b8141b0523613c68e25d98064a6085c53cd6e9f9158de60"
    }
  ],
  "layer": "verification",
  "outcome": "build_ok",
  "producer": {
    "kind": "build",
    "model": "deepseek-v4.1-flash",
    "prompt_rev": "",
    "role": "coordinator"
  },
  "timestamp": "2026-09-16T13:39:10Z"
}
