{
  "block": "B-C002",
  "environment": {
    "lean": "leanprover/lean4:v4.33.1",
    "mathlib": "0df444a360eaa60ab8c11dca51a86af692955474"
  },
  "evidence_id": "E-000042",
  "findings": [
    "Stage 1 read-back: if X is both Phi-saturated and Psi-saturated then it is saturated under the componentwise meet of Phi and Psi (one-directional).",
    "Stage 2 comparator returned equivalent; the unused second hypothesis is a proof-level observation, not a change in statement strength.",
    "Transcript: blocks/audits/B-C002-correspondence.md. Re-run after the Session 29 representation change (supersedes E-000011/E-000018)."
  ],
  "independence_caveat": "Two-stage blind protocol (Section 11.2): stage 1 (read-back) saw only the Lean declarations and definitions; stage 2 (comparison) saw only the read-back and the contract. Both stages share this session's underlying model (deepseek-v4.1-flash), so common blind spots are not excluded. Verdict is relative to the dependent-type carrier encoding; inherits its residuals.",
  "inputs": [
    {
      "artifact": "B-C002/formal_statement",
      "hash": "13e01ed764e6f62db137a891d8432b911149f476312b99944093fb0bb2229bc8"
    },
    {
      "artifact": "B-C002/informal_statement",
      "hash": "1c8874c1dfe45cd82384e4570e04dffb58486a66fd0f360eb330cd5f6ba4d955"
    },
    {
      "artifact": "B-D014/informal_statement",
      "hash": "1f69ac6b40f618f6620c281778fc48b3966349b78cb5090a39358cbd18e78f70"
    },
    {
      "artifact": "representation/encoding",
      "hash": "96171838ac26a710e6ec51562eafa2979a0b52d3bc95c7bc12e989e6a621f2d1"
    }
  ],
  "layer": "correspondence",
  "outcome": "equivalent",
  "producer": {
    "kind": "agent",
    "model": "deepseek-v4.1-flash",
    "prompt_rev": "",
    "role": "comparator"
  },
  "timestamp": "2026-09-15T07:37:46Z"
}
