{
  "block": "B-P003",
  "environment": {
    "lean": "leanprover/lean4:v4.33.1",
    "mathlib": "0df444a360eaa60ab8c11dca51a86af692955474"
  },
  "evidence_id": "E-000007",
  "findings": [
    "lake build: Mslang.nabla_sat (NablaSat, B-P003) compiled sorry-free against Mathlib v4.33.1.",
    "#print axioms Mslang.nabla_sat = [propext, Quot.sound] (within the permitted set)."
  ],
  "independence_caveat": "Verification is the local pinned build only. The formal_proof facet is a source-level hash (scripts/lean_facets.py), not an elaborated proof term; the representation has not been independently audited (E-000002 is a self-audit).",
  "inputs": [
    {
      "artifact": "B-P003/formal_proof",
      "hash": "9f03d15577f7f223c8554ae9c1179ab77ea8a9d1ac211e021b0faf14ff24dac7"
    }
  ],
  "layer": "verification",
  "outcome": "build_ok",
  "producer": {
    "kind": "build",
    "model": "deepseek-v4.1-flash",
    "prompt_rev": "",
    "role": "coordinator"
  },
  "timestamp": "2026-09-14T11:56:18Z"
}
