{
  "block": "B-P023",
  "environment": {
    "lean": "leanprover/lean4:v4.33.1",
    "mathlib": "0df444a360eaa60ab8c11dca51a86af692955474"
  },
  "evidence_id": "E-000149",
  "findings": [
    "Stage 1 read-back: isSat_iff_le_congCogenerated states IsSat Phi L <-> sortedEqvLe Phi (congCogenerated Sig A L), with hPhi : IsCongruence. The helper renders saturation as containment in Ker(ch^L).",
    "Stage 2 comparator returned equivalent; IsSat is L = [L]^Phi, sortedEqvLe is Phi subseteq Omega^A(L), hPhi is Phi in Cgr(A). The helper IsSat <-> Phi subseteq Ker(ch^L) is faithful, and the proof uses B-P022(3) in the direction that needs hPhi. No dropped/added hypothesis, no size mismatch.",
    "Transcript: blocks/audits/B-P023-correspondence.md."
  ],
  "independence_caveat": "Two-stage blind protocol (Section 11.2): stage 1 (read-back) saw only the Lean declarations and definitions; stage 2 (comparison) saw only the read-back and the contract. Both stages share this session's underlying model (deepseek-v4.1-flash), so common blind spots are not excluded. Verdict is relative to the dependent-type carrier encoding; inherits its residuals.",
  "inputs": [
    {
      "artifact": "B-C001/informal_statement",
      "hash": "c7ec842b49a13dd15580ecdf7cc00064e554a3b50aa410a3b7e9b51ba39c5d0b"
    },
    {
      "artifact": "B-D014/informal_statement",
      "hash": "1f69ac6b40f618f6620c281778fc48b3966349b78cb5090a39358cbd18e78f70"
    },
    {
      "artifact": "B-P023/definition_closure",
      "hash": "a34e267b18e410bbdd8d2faeb7d808dd2adb14cca5f75ace06b33e6f0adc07ff"
    },
    {
      "artifact": "B-P023/formal_statement",
      "hash": "e09b08f70b8c34d4a936a2c845bf8d0aa0edade73d0de6af1e9dc9e78b04109d"
    },
    {
      "artifact": "B-P023/informal_statement",
      "hash": "0be82bd8d501143da379871ba89fdfdceb6a022a957065f4a72bad62c28bb8ed"
    },
    {
      "artifact": "representation/encoding",
      "hash": "96171838ac26a710e6ec51562eafa2979a0b52d3bc95c7bc12e989e6a621f2d1"
    }
  ],
  "layer": "correspondence",
  "outcome": "equivalent",
  "producer": {
    "kind": "agent",
    "model": "deepseek-v4.1-flash",
    "prompt_rev": "",
    "role": "comparator"
  },
  "timestamp": "2026-09-17T12:45:00Z"
}
