{
  "block": "B-P025",
  "environment": {
    "lean": "leanprover/lean4:v4.33.1",
    "mathlib": "0df444a360eaa60ab8c11dca51a86af692955474"
  },
  "evidence_id": "E-000150",
  "findings": [
    "lake build under the dependent-type carrier model: B-P025 (Mslang.congCogenerated_compl) compiled against Mathlib v4.33.1.",
    "Proof: funext + Setoid.ext reduce the equality of sorted equivalences to a pointwise iff. The universal clause over translations with L and with complA L differs by replacing membership with non-membership; Iff.not handles (=>), and Iff.not plus double-negation elimination (not_not) handles (<=). complA_bridge exposes the negation.",
    "Axioms within {propext, Classical.choice, Quot.sound} (scripts/lean_audit.py, 197 declarations, 0 warnings, 0 unpermitted, 0 sorry)."
  ],
  "independence_caveat": "Verification is the local pinned build only; formal_proof is a source-level hash over the mapped declarations.",
  "inputs": [
    {
      "artifact": "B-P025/formal_proof",
      "hash": "689294fae96769d0d359f1ad1491002ad6b5a76cf1e6d575a971ef850ef85442"
    }
  ],
  "layer": "verification",
  "outcome": "build_ok",
  "producer": {
    "kind": "build",
    "model": "deepseek-v4.1-flash",
    "prompt_rev": "",
    "role": "coordinator"
  },
  "timestamp": "2026-09-17T12:45:00Z"
}
